index,_id,tags,tags1
Vedic Math,61fac1a4238e3f332d8df685,"[""Introduction about Vedic math's"", ""Benefits of Vedic math's"", 'Addition of numbers', 'Subtraction of numbers', 'Multiplication of numbers', 'Division of numbers', 'Square of a number', 'Cube of a number', 'Square root of a number', 'Cube root of a number', [""Introduction about Vedic math's"", ""Benefits of Vedic math's"", 'Addition of numbers', 'Subtraction of numbers', 'Multiplication of numbers', 'Division of numbers', 'Square of a number', 'Cube of a number', 'Square root of a number', 'Cube root of a number']]","Introduction about Vedic math's Benefits of Vedic math's Addition of numbers Subtraction of numbers Multiplication of numbers Division of numbers Square of a number Cube of a number Square root of a number Cube root of a number [""Introduction about Vedic math's"", ""Benefits of Vedic math's"", 'Addition of numbers', 'Subtraction of numbers', 'Multiplication of numbers', 'Division of numbers', 'Square of a number', 'Cube of a number', 'Square root of a number', 'Cube root of a number']"
Fundamentals of Game Development,61fac0ff238e3f11db8df619,"['Introduction to Pygame ', 'Deep-dive into Pygame ', 'Game world', 'Sprites', 'Projects on game development ', ['Introduction to Pygame ', 'Deep-dive into Pygame ', 'Game world', 'Sprites', 'Projects on game development ']]","Introduction to Pygame  Deep-dive into Pygame  Game world Sprites Projects on game development  ['Introduction to Pygame ', 'Deep-dive into Pygame ', 'Game world', 'Sprites', 'Projects on game development ']"
Fundamentals of Electronics,61fac0a1238e3f90798df577,"['Electronics Basics ', 'Circuits and symbols', 'Instrument and measurement ', 'AC/DC', 'Frequencies ', 'Semiconductor', 'Transistors', 'Digital Signal', 'Sensor Introduction', 'Projects on Electronics ', 'MonalKumar', ['Electronics Basics ', 'Circuits and symbols', 'Instrument and measurement ', 'AC/DC', 'Frequencies ', 'Semiconductor', 'Transistors', 'Digital Signal', 'Sensor Introduction', 'Projects on Electronics ']]","Electronics Basics  Circuits and symbols Instrument and measurement  AC/DC Frequencies  Semiconductor Transistors Digital Signal Sensor Introduction Projects on Electronics  MonalKumar ['Electronics Basics ', 'Circuits and symbols', 'Instrument and measurement ', 'AC/DC', 'Frequencies ', 'Semiconductor', 'Transistors', 'Digital Signal', 'Sensor Introduction', 'Projects on Electronics ']"
App Building Using Android,61fabf79238e3fac4f8df4b1,"['Introduction to JAVA', 'Activity in android', 'View in android ', 'Widgets, Pixel, and Layout', 'Adaptors in android', 'Intents in android ', 'Gestures and Fragments ', 'Data Storage ', 'Database storage ', 'Creating android projects ', ['Introduction to JAVA', 'Activity in android', 'View in android ', 'Widgets, Pixel, and Layout', 'Adaptors in android', 'Intents in android ', 'Gestures and Fragments ', 'Data Storage ', 'Database storage ', 'Creating android projects ']]","Introduction to JAVA Activity in android View in android  Widgets, Pixel, and Layout Adaptors in android Intents in android  Gestures and Fragments  Data Storage  Database storage  Creating android projects  ['Introduction to JAVA', 'Activity in android', 'View in android ', 'Widgets, Pixel, and Layout', 'Adaptors in android', 'Intents in android ', 'Gestures and Fragments ', 'Data Storage ', 'Database storage ', 'Creating android projects ']"
Advanced Python,61fabe19238e3f3b8b8df3f7,"['Python Flow control', 'List', 'Tuple', 'sets', 'Dictionary', 'Python Functions', 'Python Programs', 'ShubhamSharma', ['Python Flow control', 'List', 'Tuple', 'sets', 'Dictionary', 'Python Functions', 'Python Programs']]","Python Flow control List Tuple sets Dictionary Python Functions Python Programs ShubhamSharma ['Python Flow control', 'List', 'Tuple', 'sets', 'Dictionary', 'Python Functions', 'Python Programs']"
Building Chatbot using Google DialogFlow,61fab97f238e3f1d888df308,"['Chatbot Introduction', 'Basics of Dialogflow', 'Applications using GCP Dialogflow with UI', 'Integration', 'Projects                                                    ', 'ShivanKumar', ['Chatbot Introduction', 'Basics of Dialogflow', 'Applications using GCP Dialogflow with UI', 'Integration', 'Projects                                                    ']]","Chatbot Introduction Basics of Dialogflow Applications using GCP Dialogflow with UI Integration Projects                                                     ShivanKumar ['Chatbot Introduction', 'Basics of Dialogflow', 'Applications using GCP Dialogflow with UI', 'Integration', 'Projects                                                    ']"
Programming in Python,61fab8d1238e3f86dd8df292,"['Introduction to Python programming language', 'Features of python', 'Application of python', 'Integrated development environment', 'Introduction to python variables', 'Introduction to Data types', 'Introduction to python operators and Strings', 'Python Programs', 'ShubhamSharma', ['Introduction to Python programming language', 'Features of python', 'Application of python', 'Integrated development environment', 'Introduction to python variables', 'Introduction to Data types', 'Introduction to python operators and Strings', 'Python Programs']]","Introduction to Python programming language Features of python Application of python Integrated development environment Introduction to python variables Introduction to Data types Introduction to python operators and Strings Python Programs ShubhamSharma ['Introduction to Python programming language', 'Features of python', 'Application of python', 'Integrated development environment', 'Introduction to python variables', 'Introduction to Data types', 'Introduction to python operators and Strings', 'Python Programs']"
Graphics Design with PhotoShop,61fab6f6238e3f3a1b8df1c7,"['Introduction to the course', 'Photoshop tools', 'Layers in Photoshop', 'Filters in Photoshop', 'Layer effects in Photoshop', 'Graphic Design works ', 'Create Projects ', '', '', ['Introduction to the course', 'Photoshop tools', 'Layers in Photoshop', 'Filters in Photoshop', 'Layer effects in Photoshop', 'Graphic Design works ', 'Create Projects ', '', '']]","Introduction to the course Photoshop tools Layers in Photoshop Filters in Photoshop Layer effects in Photoshop Graphic Design works  Create Projects    ['Introduction to the course', 'Photoshop tools', 'Layers in Photoshop', 'Filters in Photoshop', 'Layer effects in Photoshop', 'Graphic Design works ', 'Create Projects ', '', '']"
Basics of Computer Education,61fab2c0238e3f80238df0f8,"['Introduction of Computers', 'Components of Computer', 'Features of Computer', 'Overview about Input and output devices', 'Overview of operating system', 'Memory management', 'How to Operate Computer', 'Introduction of Microsoft office', 'Paint', 'Email Operation', 'YouTube Operation', ['Introduction of Computers', 'Components of Computer', 'Features of Computer', 'Overview about Input and output devices', 'Overview of operating system', 'Memory management', 'How to Operate Computer', 'Introduction of Microsoft office', 'Paint', 'Email Operation', 'YouTube Operation']]","Introduction of Computers Components of Computer Features of Computer Overview about Input and output devices Overview of operating system Memory management How to Operate Computer Introduction of Microsoft office Paint Email Operation YouTube Operation ['Introduction of Computers', 'Components of Computer', 'Features of Computer', 'Overview about Input and output devices', 'Overview of operating system', 'Memory management', 'How to Operate Computer', 'Introduction of Microsoft office', 'Paint', 'Email Operation', 'YouTube Operation']"
Class 9th Biology,61fa81a924fd4d59418b913f,"['Cell - the fundamental unit of life', 'Tissues', 'Diversity in living organisms', 'Why do we fall ill?', 'Natural Resources', 'Improvemement in food resources', 'DrNishthaJain', ['Cell - the fundamental unit of life', 'Tissues', 'Diversity in living organisms', 'Why do we fall ill?', 'Natural Resources', 'Improvemement in food resources']]","Cell - the fundamental unit of life Tissues Diversity in living organisms Why do we fall ill? Natural Resources Improvemement in food resources DrNishthaJain ['Cell - the fundamental unit of life', 'Tissues', 'Diversity in living organisms', 'Why do we fall ill?', 'Natural Resources', 'Improvemement in food resources']"
Jenkins,61f913a350ec30969529b2be,"['Jenkins Installation Basics', 'Jenkins Dashboard', 'Jenkins Plugins', 'Jenkins Security', 'Jenkins Jobs', 'Freestyle Jobs', 'Pipeline Job', ['Jenkins Installation Basics', 'Jenkins Dashboard', 'Jenkins Plugins', 'Jenkins Security', 'Jenkins Jobs', 'Freestyle Jobs', 'Pipeline Job']]","Jenkins Installation Basics Jenkins Dashboard Jenkins Plugins Jenkins Security Jenkins Jobs Freestyle Jobs Pipeline Job ['Jenkins Installation Basics', 'Jenkins Dashboard', 'Jenkins Plugins', 'Jenkins Security', 'Jenkins Jobs', 'Freestyle Jobs', 'Pipeline Job']"
ParlAI Chatbot,61f8f72350ec30780829b280,"['ParlAI framework in detail', 'Basic concepts', 'Installation', ' Tutorials', 'Creating a chatbot', 'KhushaliShah', ['ParlAI framework in detail', 'Basic concepts', 'Installation', ' Tutorials', 'Creating a chatbot']]","ParlAI framework in detail Basic concepts Installation  Tutorials Creating a chatbot KhushaliShah ['ParlAI framework in detail', 'Basic concepts', 'Installation', ' Tutorials', 'Creating a chatbot']"
Qlik Sense,61f8e81550ec30731029b253,"['Qlik sense features', 'Basic concepts', 'Installation', 'Tutorial', 'Build Charts', 'Building Dashboards', 'Project', 'KhushaliShah', ['Qlik sense features', 'Basic concepts', 'Installation', 'Tutorial', 'Build Charts', 'Building Dashboards', 'Project']]","Qlik sense features Basic concepts Installation Tutorial Build Charts Building Dashboards Project KhushaliShah ['Qlik sense features', 'Basic concepts', 'Installation', 'Tutorial', 'Build Charts', 'Building Dashboards', 'Project']"
ONNX,61ef10dd40c28f6e80ec2a65,"['BoktiarAhmedBappy', []]",BoktiarAhmedBappy []
Solidity,61ee915edb44e9f8661d7f38,"['Solidity Fundamentals', 'Smart Contracts in Solidity', 'Data types and Variables', 'Functions', 'Storage vs Memory', 'Events and logs', 'Factory contract', 'Inheritance', 'Inline Assembly', 'Application Binary Interface', 'Smart Contracts Pitfalls , Testing and Debugging', 'Testing smart Contracts ', 'Unit tests', 'Integration Tests', 'Javascript tests', 'Smart Contract Best Practices', 'Creating our own cryptocurrency on Ethereum Network', 'What are ICO and what are tokens', 'Understanding about ERC-20', 'Writing code for our cryptocurrency', 'Safe Math', 'Creating the cryptocurrency', 'Deploying it to the network', 'Solana Blockchain', 'Introduction to solana Blockchain', 'Creating our own cryptocurrency on the Solana Network', 'Understanding about Sol-Tokens', 'Writing code for our cryptocurrency', 'Deploying the currency to the network.', 'Creating our own Solana Token using CLI', 'Installing Virtual Box Ubuntu', 'Downloading the Solana CLI', 'Creating the tokens', 'Web 3.0  & Connecting everything into a project', 'What is Web 3.0 ?', 'iNeuron Marketplace course', 'Installing npm, git and node.js', 'Basic project setup', 'Creating the marketplace contract', 'Adding courses', 'Buying courses', 'Building out the front end', 'Building out the front end part 2', 'Deploying the project', 'A little more about ethereum', 'Ethereum naming service', 'Intro to IPFS', 'Oracles ', 'DeFI', 'NFTs', 'What are NFTs and ERC721', 'Creating our project and installing in dependencies', 'Creating the contract', 'Creating the scripts', 'iPFS', 'Deploying the NFT to the network.', ['Solidity Fundamentals', 'Smart Contracts in Solidity', 'Data types and Variables', 'Functions', 'Storage vs Memory', 'Events and logs', 'Factory contract', 'Inheritance', 'Inline Assembly', 'Application Binary Interface', 'Smart Contracts Pitfalls , Testing and Debugging', 'Testing smart Contracts ', 'Unit tests', 'Integration Tests', 'Javascript tests', 'Smart Contract Best Practices', 'Creating our own cryptocurrency on Ethereum Network', 'What are ICO and what are tokens', 'Understanding about ERC-20', 'Writing code for our cryptocurrency', 'Safe Math', 'Creating the cryptocurrency', 'Deploying it to the network', 'Solana Blockchain', 'Introduction to solana Blockchain', 'Creating our own cryptocurrency on the Solana Network', 'Understanding about Sol-Tokens', 'Writing code for our cryptocurrency', 'Deploying the currency to the network.', 'Creating our own Solana Token using CLI', 'Installing Virtual Box Ubuntu', 'Downloading the Solana CLI', 'Creating the tokens', 'Web 3.0  & Connecting everything into a project', 'What is Web 3.0 ?', 'iNeuron Marketplace course', 'Installing npm, git and node.js', 'Basic project setup', 'Creating the marketplace contract', 'Adding courses', 'Buying courses', 'Building out the front end', 'Building out the front end part 2', 'Deploying the project', 'A little more about ethereum', 'Ethereum naming service', 'Intro to IPFS', 'Oracles ', 'DeFI', 'NFTs', 'What are NFTs and ERC721', 'Creating our project and installing in dependencies', 'Creating the contract', 'Creating the scripts', 'iPFS', 'Deploying the NFT to the network.']]","Solidity Fundamentals Smart Contracts in Solidity Data types and Variables Functions Storage vs Memory Events and logs Factory contract Inheritance Inline Assembly Application Binary Interface Smart Contracts Pitfalls , Testing and Debugging Testing smart Contracts  Unit tests Integration Tests Javascript tests Smart Contract Best Practices Creating our own cryptocurrency on Ethereum Network What are ICO and what are tokens Understanding about ERC-20 Writing code for our cryptocurrency Safe Math Creating the cryptocurrency Deploying it to the network Solana Blockchain Introduction to solana Blockchain Creating our own cryptocurrency on the Solana Network Understanding about Sol-Tokens Writing code for our cryptocurrency Deploying the currency to the network. Creating our own Solana Token using CLI Installing Virtual Box Ubuntu Downloading the Solana CLI Creating the tokens Web 3.0  & Connecting everything into a project What is Web 3.0 ? iNeuron Marketplace course Installing npm, git and node.js Basic project setup Creating the marketplace contract Adding courses Buying courses Building out the front end Building out the front end part 2 Deploying the project A little more about ethereum Ethereum naming service Intro to IPFS Oracles  DeFI NFTs What are NFTs and ERC721 Creating our project and installing in dependencies Creating the contract Creating the scripts iPFS Deploying the NFT to the network. ['Solidity Fundamentals', 'Smart Contracts in Solidity', 'Data types and Variables', 'Functions', 'Storage vs Memory', 'Events and logs', 'Factory contract', 'Inheritance', 'Inline Assembly', 'Application Binary Interface', 'Smart Contracts Pitfalls , Testing and Debugging', 'Testing smart Contracts ', 'Unit tests', 'Integration Tests', 'Javascript tests', 'Smart Contract Best Practices', 'Creating our own cryptocurrency on Ethereum Network', 'What are ICO and what are tokens', 'Understanding about ERC-20', 'Writing code for our cryptocurrency', 'Safe Math', 'Creating the cryptocurrency', 'Deploying it to the network', 'Solana Blockchain', 'Introduction to solana Blockchain', 'Creating our own cryptocurrency on the Solana Network', 'Understanding about Sol-Tokens', 'Writing code for our cryptocurrency', 'Deploying the currency to the network.', 'Creating our own Solana Token using CLI', 'Installing Virtual Box Ubuntu', 'Downloading the Solana CLI', 'Creating the tokens', 'Web 3.0  & Connecting everything into a project', 'What is Web 3.0 ?', 'iNeuron Marketplace course', 'Installing npm, git and node.js', 'Basic project setup', 'Creating the marketplace contract', 'Adding courses', 'Buying courses', 'Building out the front end', 'Building out the front end part 2', 'Deploying the project', 'A little more about ethereum', 'Ethereum naming service', 'Intro to IPFS', 'Oracles ', 'DeFI', 'NFTs', 'What are NFTs and ERC721', 'Creating our project and installing in dependencies', 'Creating the contract', 'Creating the scripts', 'iPFS', 'Deploying the NFT to the network.']"
Mega Project Foundation,61ebf794ec1eea350c408b73,"['Statistics ', 'Blockchain', 'Android', 'DSA', 'DevOPS', 'Python', 'PowerBI', 'SQL', 'Projects', 'Drone ', 'Robotics', 'AI in edge devices', 'krishnaik', ['Statistics ', 'Blockchain', 'Android', 'DSA', 'DevOPS', 'Python', 'PowerBI', 'SQL', 'Projects', 'Drone ', 'Robotics', 'AI in edge devices']]","Statistics  Blockchain Android DSA DevOPS Python PowerBI SQL Projects Drone  Robotics AI in edge devices krishnaik ['Statistics ', 'Blockchain', 'Android', 'DSA', 'DevOPS', 'Python', 'PowerBI', 'SQL', 'Projects', 'Drone ', 'Robotics', 'AI in edge devices']"
Data Science Masters,61e9b66e47eea35cecf3f7b9,"['Python', 'Stats', 'Machine learning', 'Deep learning', 'Computer vision', 'Natural language processing', 'Data analytics', 'Big data', 'Ml ops', 'Cloud', 'Data structure and algorithm', 'Architecture', 'Domain wise project', 'Databases', 'Negotiations skills', 'Mock interview', 'Interview preparation', 'Resume building after every module', 'SunnyBhaveenChandra', 'SourangshuPal', 'KhushaliShah', 'krishnaik', 'SudhanshuKumar', ['Python', 'Stats', 'Machine learning', 'Deep learning', 'Computer vision', 'Natural language processing', 'Data analytics', 'Big data', 'Ml ops', 'Cloud', 'Data structure and algorithm', 'Architecture', 'Domain wise project', 'Databases', 'Negotiations skills', 'Mock interview', 'Interview preparation', 'Resume building after every module']]","Python Stats Machine learning Deep learning Computer vision Natural language processing Data analytics Big data Ml ops Cloud Data structure and algorithm Architecture Domain wise project Databases Negotiations skills Mock interview Interview preparation Resume building after every module SunnyBhaveenChandra SourangshuPal KhushaliShah krishnaik SudhanshuKumar ['Python', 'Stats', 'Machine learning', 'Deep learning', 'Computer vision', 'Natural language processing', 'Data analytics', 'Big data', 'Ml ops', 'Cloud', 'Data structure and algorithm', 'Architecture', 'Domain wise project', 'Databases', 'Negotiations skills', 'Mock interview', 'Interview preparation', 'Resume building after every module']"
Angular,61e81fe3c7b80a9ddcc78df2,"['Angular use', 'Use of TypeScript in between', 'Building Components', 'Databinding', 'Routing', 'Pipes and their uses', 'Resful services(API)', 'Modules', 'SyedAshraf', ['Angular use', 'Use of TypeScript in between', 'Building Components', 'Databinding', 'Routing', 'Pipes and their uses', 'Resful services(API)', 'Modules']]","Angular use Use of TypeScript in between Building Components Databinding Routing Pipes and their uses Resful services(API) Modules SyedAshraf ['Angular use', 'Use of TypeScript in between', 'Building Components', 'Databinding', 'Routing', 'Pipes and their uses', 'Resful services(API)', 'Modules']"
DART,61e80e3cc2c8c0bbb635ff26,"['Learn Dart from scratch to Classes & Objects', 'A step towards build mobile apps', 'Learn how to write control flow statements', 'Learn how to compile and debug the code', 'Learn all the basics without stopping after then: Dive deeply into Flutter & Dart and become an advanced developer', 'SyedAshraf', ['Learn Dart from scratch to Classes & Objects', 'A step towards build mobile apps', 'Learn how to write control flow statements', 'Learn how to compile and debug the code', 'Learn all the basics without stopping after then: Dive deeply into Flutter & Dart and become an advanced developer']]","Learn Dart from scratch to Classes & Objects A step towards build mobile apps Learn how to write control flow statements Learn how to compile and debug the code Learn all the basics without stopping after then: Dive deeply into Flutter & Dart and become an advanced developer SyedAshraf ['Learn Dart from scratch to Classes & Objects', 'A step towards build mobile apps', 'Learn how to write control flow statements', 'Learn how to compile and debug the code', 'Learn all the basics without stopping after then: Dive deeply into Flutter & Dart and become an advanced developer']"
JAX,61e7c019c020da0d7998660a,"['Basic understanding of digital marketing tools', 'Search engine optimization techniques', 'How to work on Google ads', 'Social media marketing on various platforms', 'Email marketing using Mailchimp', 'Content creations like written, graphics and video', 'BoktiarAhmedBappy', ['Basic understanding of digital marketing tools', 'Search engine optimization techniques', 'How to work on Google ads', 'Social media marketing on various platforms', 'Email marketing using Mailchimp', 'Content creations like written, graphics and video']]","Basic understanding of digital marketing tools Search engine optimization techniques How to work on Google ads Social media marketing on various platforms Email marketing using Mailchimp Content creations like written, graphics and video BoktiarAhmedBappy ['Basic understanding of digital marketing tools', 'Search engine optimization techniques', 'How to work on Google ads', 'Social media marketing on various platforms', 'Email marketing using Mailchimp', 'Content creations like written, graphics and video']"
Recommender System,61e7b8da3ae15a3095c93c03,"['Basic understanding of digital marketing tools', 'Search engine optimization techniques', 'How to work on Google ads', 'Social media marketing on various platforms', 'Email marketing using Mailchimp', 'Content creations like written, graphics and video', 'BoktiarAhmedBappy', ['Basic understanding of digital marketing tools', 'Search engine optimization techniques', 'How to work on Google ads', 'Social media marketing on various platforms', 'Email marketing using Mailchimp', 'Content creations like written, graphics and video']]","Basic understanding of digital marketing tools Search engine optimization techniques How to work on Google ads Social media marketing on various platforms Email marketing using Mailchimp Content creations like written, graphics and video BoktiarAhmedBappy ['Basic understanding of digital marketing tools', 'Search engine optimization techniques', 'How to work on Google ads', 'Social media marketing on various platforms', 'Email marketing using Mailchimp', 'Content creations like written, graphics and video']"
Blockchain,61e5709048ab3d5b1ef0269f,"['Origin of Blockchain', 'Review of Blockchain', 'Blockchain Primitives', 'Security and Privacy Mechanisms', 'Ethereum Basics', 'Capstone Project', ['Origin of Blockchain', 'Review of Blockchain', 'Blockchain Primitives', 'Security and Privacy Mechanisms', 'Ethereum Basics', 'Capstone Project']]","Origin of Blockchain Review of Blockchain Blockchain Primitives Security and Privacy Mechanisms Ethereum Basics Capstone Project ['Origin of Blockchain', 'Review of Blockchain', 'Blockchain Primitives', 'Security and Privacy Mechanisms', 'Ethereum Basics', 'Capstone Project']"
DevOps Master,61df162f1463c83ed4e6b0f1,"['Linux', 'Git', 'Docker', 'Kubernetes', 'Openshift', 'Ansible', 'Terraform', 'SunnyBhaveenChandra', 'SourangshuPal', ['Linux', 'Git', 'Docker', 'Kubernetes', 'Openshift', 'Ansible', 'Terraform']]","Linux Git Docker Kubernetes Openshift Ansible Terraform SunnyBhaveenChandra SourangshuPal ['Linux', 'Git', 'Docker', 'Kubernetes', 'Openshift', 'Ansible', 'Terraform']"
Machine Learning Masters,61df125b1463c83ed4e6b0e6,"['Python', 'Stats', 'Machine learning', 'Deep learning', 'Data analytics', 'Mock interview', 'Interview preparation', 'Resume building ', 'SunnyBhaveenChandra', 'SourangshuPal', 'krishnaik', 'SudhanshuKumar', ['Python', 'Stats', 'Machine learning', 'Deep learning', 'Data analytics', 'Mock interview', 'Interview preparation', 'Resume building ']]","Python Stats Machine learning Deep learning Data analytics Mock interview Interview preparation Resume building  SunnyBhaveenChandra SourangshuPal krishnaik SudhanshuKumar ['Python', 'Stats', 'Machine learning', 'Deep learning', 'Data analytics', 'Mock interview', 'Interview preparation', 'Resume building ']"
