index,_id,tags,tags1
Complete Angular Developer Bootcamp,62d6c809ff20c4ab5a5d1ad3,"['Getting started with angular', 'TypeScript that you need for Angular', ""Let's Build counter"", 'Core foundation of angular apps', 'Generator - user input', 'Game- passing info to parent', 'RxJs fundamentals', 'Project:- Form service and pipe in angular project', 'Project :- SignUp reactive form in Angualar', 'Project:- Web request and API in Angular', 'Project:- Fire base login and github searcher', 'HiteshChoudhary', ['Getting started with angular', 'TypeScript that you need for Angular', ""Let's Build counter"", 'Core foundation of angular apps', 'Generator - user input', 'Game- passing info to parent', 'RxJs fundamentals', 'Project:- Form service and pipe in angular project', 'Project :- SignUp reactive form in Angualar', 'Project:- Web request and API in Angular', 'Project:- Fire base login and github searcher']]","Getting started with angular TypeScript that you need for Angular Let's Build counter Core foundation of angular apps Generator - user input Game- passing info to parent RxJs fundamentals Project:- Form service and pipe in angular project Project :- SignUp reactive form in Angualar Project:- Web request and API in Angular Project:- Fire base login and github searcher HiteshChoudhary ['Getting started with angular', 'TypeScript that you need for Angular', ""Let's Build counter"", 'Core foundation of angular apps', 'Generator - user input', 'Game- passing info to parent', 'RxJs fundamentals', 'Project:- Form service and pipe in angular project', 'Project :- SignUp reactive form in Angualar', 'Project:- Web request and API in Angular', 'Project:- Fire base login and github searcher']"
Mysql Bootcamp for Beginners,62d6c34bff20c4cddf5d193e,"['MySQL tables', 'Primary keys and foreign keys', 'CRUD operations', 'SQL queries', 'Joins', 'ACID in database', 'Database engines', 'HiteshChoudhary', ['MySQL tables', 'Primary keys and foreign keys', 'CRUD operations', 'SQL queries', 'Joins', 'ACID in database', 'Database engines']]","MySQL tables Primary keys and foreign keys CRUD operations SQL queries Joins ACID in database Database engines HiteshChoudhary ['MySQL tables', 'Primary keys and foreign keys', 'CRUD operations', 'SQL queries', 'Joins', 'ACID in database', 'Database engines']"
Crack the Tech Interviews,62d6c036ff20c414c15d16e6,"['Non Tech Round Preparation', 'Array interview problems and solutions', 'String interview problems and solutions', 'Recursion interview problems and solutions', 'Linked list interview problems and solutions', 'Math interview problems and solutions', 'Stack and Queue interview problems and solutions', 'Sorting interview problems and solutions', 'Trees interview problems and solutions', 'Graphs interview problems and solutions', 'Dynamic programming interview problems and solutions', 'HiteshChoudhary', ['Non Tech Round Preparation', 'Array interview problems and solutions', 'String interview problems and solutions', 'Recursion interview problems and solutions', 'Linked list interview problems and solutions', 'Math interview problems and solutions', 'Stack and Queue interview problems and solutions', 'Sorting interview problems and solutions', 'Trees interview problems and solutions', 'Graphs interview problems and solutions', 'Dynamic programming interview problems and solutions']]","Non Tech Round Preparation Array interview problems and solutions String interview problems and solutions Recursion interview problems and solutions Linked list interview problems and solutions Math interview problems and solutions Stack and Queue interview problems and solutions Sorting interview problems and solutions Trees interview problems and solutions Graphs interview problems and solutions Dynamic programming interview problems and solutions HiteshChoudhary ['Non Tech Round Preparation', 'Array interview problems and solutions', 'String interview problems and solutions', 'Recursion interview problems and solutions', 'Linked list interview problems and solutions', 'Math interview problems and solutions', 'Stack and Queue interview problems and solutions', 'Sorting interview problems and solutions', 'Trees interview problems and solutions', 'Graphs interview problems and solutions', 'Dynamic programming interview problems and solutions']"
Complete React Native Mobile App Developer,62d6bee6ff20c463375d1532,"['React elements', 'React styles', 'Touchable and props', 'Handling images in React', 'Handling sound in React', 'Handling multiple users', 'Camera integration', 'Redux', 'HiteshChoudhary', ['React elements', 'React styles', 'Touchable and props', 'Handling images in React', 'Handling sound in React', 'Handling multiple users', 'Camera integration', 'Redux']]","React elements React styles Touchable and props Handling images in React Handling sound in React Handling multiple users Camera integration Redux HiteshChoudhary ['React elements', 'React styles', 'Touchable and props', 'Handling images in React', 'Handling sound in React', 'Handling multiple users', 'Camera integration', 'Redux']"
Complete VueJS Development,62d6bda9ff20c431415d1365,"['VueJs project structure', 'VueJs data types and methods', 'Passing data to props', 'Adding editable forms in todo', 'Passing methods in vueJs', 'HiteshChoudhary', ['VueJs project structure', 'VueJs data types and methods', 'Passing data to props', 'Adding editable forms in todo', 'Passing methods in vueJs']]","VueJs project structure VueJs data types and methods Passing data to props Adding editable forms in todo Passing methods in vueJs HiteshChoudhary ['VueJs project structure', 'VueJs data types and methods', 'Passing data to props', 'Adding editable forms in todo', 'Passing methods in vueJs']"
The Pro Backend Developer,62d6bc77ff20c431d55d10a8,"['MongoDB', 'Heroku Cloud', 'Swagger', 'Authentication', 'File,image and form handling', 'MORGAN and razorpay', 'Configs and imports', 'Controllers and routes', 'HiteshChoudhary', ['MongoDB', 'Heroku Cloud', 'Swagger', 'Authentication', 'File,image and form handling', 'MORGAN and razorpay', 'Configs and imports', 'Controllers and routes']]","MongoDB Heroku Cloud Swagger Authentication File,image and form handling MORGAN and razorpay Configs and imports Controllers and routes HiteshChoudhary ['MongoDB', 'Heroku Cloud', 'Swagger', 'Authentication', 'File,image and form handling', 'MORGAN and razorpay', 'Configs and imports', 'Controllers and routes']"
AWS Architect for the Real World,62d6bafeff20c40c8e5d0c91,"['AWS fundamentals', 'S3 buckets', 'Lambda functions', 'SES', 'API gateways', 'Load balancing', 'Migration', 'Container services', 'AWS serverless', 'HiteshChoudhary', ['AWS fundamentals', 'S3 buckets', 'Lambda functions', 'SES', 'API gateways', 'Load balancing', 'Migration', 'Container services', 'AWS serverless']]","AWS fundamentals S3 buckets Lambda functions SES API gateways Load balancing Migration Container services AWS serverless HiteshChoudhary ['AWS fundamentals', 'S3 buckets', 'Lambda functions', 'SES', 'API gateways', 'Load balancing', 'Migration', 'Container services', 'AWS serverless']"
HTML and CSS for Web Development,62d692f5a782a73d2fa7d125,"['HTML and DOM', 'We do  not write without emmet', 'Starting with CSS', 'Mobile responsive webpages', 'CSS animation and libraries', 'Flexbox in CSS', 'HiteshChoudhary', ['HTML and DOM', 'We do  not write without emmet', 'Starting with CSS', 'Mobile responsive webpages', 'CSS animation and libraries', 'Flexbox in CSS']]","HTML and DOM We do  not write without emmet Starting with CSS Mobile responsive webpages CSS animation and libraries Flexbox in CSS HiteshChoudhary ['HTML and DOM', 'We do  not write without emmet', 'Starting with CSS', 'Mobile responsive webpages', 'CSS animation and libraries', 'Flexbox in CSS']"
JavaScript Fundamentals,62d670fa5af3c7d16e42a254,"['Basics of JavaScript', 'What are JavaScript engines', 'Objects in JavaScript', 'Methods and objects in JavaScript', 'What is DOM?', 'New keyword in JavaScript', 'What is proto in JavaScript', 'How to Handle API in JavaScript', 'HiteshChoudhary', ['Basics of JavaScript', 'What are JavaScript engines', 'Objects in JavaScript', 'Methods and objects in JavaScript', 'What is DOM?', 'New keyword in JavaScript', 'What is proto in JavaScript', 'How to Handle API in JavaScript']]","Basics of JavaScript What are JavaScript engines Objects in JavaScript Methods and objects in JavaScript What is DOM? New keyword in JavaScript What is proto in JavaScript How to Handle API in JavaScript HiteshChoudhary ['Basics of JavaScript', 'What are JavaScript engines', 'Objects in JavaScript', 'Methods and objects in JavaScript', 'What is DOM?', 'New keyword in JavaScript', 'What is proto in JavaScript', 'How to Handle API in JavaScript']"
HTML and CSS,62d66d9d5af3c75b2b42a124,"['HTML and DOM', 'We do  not write without emmet', 'Starting with CSS', 'Mobile responsive webpages', 'CSS animation and libraries', 'Flexbox in CSS', 'HiteshChoudhary', ['HTML and DOM', 'We do  not write without emmet', 'Starting with CSS', 'Mobile responsive webpages', 'CSS animation and libraries', 'Flexbox in CSS']]","HTML and DOM We do  not write without emmet Starting with CSS Mobile responsive webpages CSS animation and libraries Flexbox in CSS HiteshChoudhary ['HTML and DOM', 'We do  not write without emmet', 'Starting with CSS', 'Mobile responsive webpages', 'CSS animation and libraries', 'Flexbox in CSS']"
Ethical Hacking & Penetration Testing,62d1b4e75af3c7b9ab429b15,"['Introduction to the world of Security Audits and Ethical Hacking', 'Setting up your own pentesting lab', 'Getting friendly with Linux and security related commands', 'Maintaining anonymity', 'Information Gathering with Kali & Web apps', 'Introduction to web pentesting and dvwa testing environment', 'Command Injection (Low-Medium-High), Mitigation and Incident Case Study', 'Cookie manipulating and insecure session management', 'Burpsuite complete training with fundamentals', 'File upload vulnerability', 'SQL Injection', 'Boolean Injection & automation with SQL Injection', ['Introduction to the world of Security Audits and Ethical Hacking', 'Setting up your own pentesting lab', 'Getting friendly with Linux and security related commands', 'Maintaining anonymity', 'Information Gathering with Kali & Web apps', 'Introduction to web pentesting and dvwa testing environment', 'Command Injection (Low-Medium-High), Mitigation and Incident Case Study', 'Cookie manipulating and insecure session management', 'Burpsuite complete training with fundamentals', 'File upload vulnerability', 'SQL Injection', 'Boolean Injection & automation with SQL Injection']]","Introduction to the world of Security Audits and Ethical Hacking Setting up your own pentesting lab Getting friendly with Linux and security related commands Maintaining anonymity Information Gathering with Kali & Web apps Introduction to web pentesting and dvwa testing environment Command Injection (Low-Medium-High), Mitigation and Incident Case Study Cookie manipulating and insecure session management Burpsuite complete training with fundamentals File upload vulnerability SQL Injection Boolean Injection & automation with SQL Injection ['Introduction to the world of Security Audits and Ethical Hacking', 'Setting up your own pentesting lab', 'Getting friendly with Linux and security related commands', 'Maintaining anonymity', 'Information Gathering with Kali & Web apps', 'Introduction to web pentesting and dvwa testing environment', 'Command Injection (Low-Medium-High), Mitigation and Incident Case Study', 'Cookie manipulating and insecure session management', 'Burpsuite complete training with fundamentals', 'File upload vulnerability', 'SQL Injection', 'Boolean Injection & automation with SQL Injection']"
Crack the Tech Interview,62d1b2945af3c7d28342993a,"['Non Tech Round Preparation', 'Array interview problems and solutions', 'String interview problems and solutions', 'Recursion interview problems and solutions', 'Linked list interview problems and solutions', 'Math interview problems and solutions', 'Stack and Queue interview problems and solutions', 'Sorting interview problems and solutions', 'Trees interview problems and solutions', 'Graphs interview problems and solutions', 'Dynamic programming interview problems and solutions', 'HiteshChoudhary', ['Non Tech Round Preparation', 'Array interview problems and solutions', 'String interview problems and solutions', 'Recursion interview problems and solutions', 'Linked list interview problems and solutions', 'Math interview problems and solutions', 'Stack and Queue interview problems and solutions', 'Sorting interview problems and solutions', 'Trees interview problems and solutions', 'Graphs interview problems and solutions', 'Dynamic programming interview problems and solutions']]","Non Tech Round Preparation Array interview problems and solutions String interview problems and solutions Recursion interview problems and solutions Linked list interview problems and solutions Math interview problems and solutions Stack and Queue interview problems and solutions Sorting interview problems and solutions Trees interview problems and solutions Graphs interview problems and solutions Dynamic programming interview problems and solutions HiteshChoudhary ['Non Tech Round Preparation', 'Array interview problems and solutions', 'String interview problems and solutions', 'Recursion interview problems and solutions', 'Linked list interview problems and solutions', 'Math interview problems and solutions', 'Stack and Queue interview problems and solutions', 'Sorting interview problems and solutions', 'Trees interview problems and solutions', 'Graphs interview problems and solutions', 'Dynamic programming interview problems and solutions']"
Write quicker HTML5 and CSS 3; productivity hacks with emmet4,62d1acb95af3c72503429884,"['Getting started with emmet', 'Ememet and speedy html', 'Parent child and grouping', 'emmet in css', 'An old style blog', 'Why DOM is important', 'Inline vs Block and bring in images', 'Lists and interlinking pages', 'Getting a video on service page', '3 Plans in a table', 'GET and POST forms', 'Types of input forms', 'Secret to learn CSS', 'HiteshChoudhary', ['Getting started with emmet', 'Ememet and speedy html', 'Parent child and grouping', 'emmet in css', 'An old style blog', 'Why DOM is important', 'Inline vs Block and bring in images', 'Lists and interlinking pages', 'Getting a video on service page', '3 Plans in a table', 'GET and POST forms', 'Types of input forms', 'Secret to learn CSS']]","Getting started with emmet Ememet and speedy html Parent child and grouping emmet in css An old style blog Why DOM is important Inline vs Block and bring in images Lists and interlinking pages Getting a video on service page 3 Plans in a table GET and POST forms Types of input forms Secret to learn CSS HiteshChoudhary ['Getting started with emmet', 'Ememet and speedy html', 'Parent child and grouping', 'emmet in css', 'An old style blog', 'Why DOM is important', 'Inline vs Block and bring in images', 'Lists and interlinking pages', 'Getting a video on service page', '3 Plans in a table', 'GET and POST forms', 'Types of input forms', 'Secret to learn CSS']"
The Complete Front End Web Developer Bootcamp,62d1aaa95af3c71c0442968b,"['Introduction, getting the dev tools and basics of HTML', 'Div, tables and Forms with Challenge to create FB page', 'HTML 5 semantics and adding audio, video and YouTube to web', 'CSS-Box model, color selection, Google Fonts', 'Web development projects - GYM and Sushi Restro Templates', ""CSS - classes, ID's, parallax and project to edit template"", 'CSS - box sizing, gradients and TODO list project', 'Getting started with Bootstrap - Tour and creating landing page', 'Project - Pokemon Corporate site, yahoo selling page and Adm', 'Javascript projects to practice', 'Moving on to learn Jquery - Selectors and event', 'Actions in Jquery - fading, animations and callback function', 'Projects in Jquery and using JS plugins', 'HiteshChoudhary', ['Introduction, getting the dev tools and basics of HTML', 'Div, tables and Forms with Challenge to create FB page', 'HTML 5 semantics and adding audio, video and YouTube to web', 'CSS-Box model, color selection, Google Fonts', 'Web development projects - GYM and Sushi Restro Templates', ""CSS - classes, ID's, parallax and project to edit template"", 'CSS - box sizing, gradients and TODO list project', 'Getting started with Bootstrap - Tour and creating landing page', 'Project - Pokemon Corporate site, yahoo selling page and Adm', 'Javascript projects to practice', 'Moving on to learn Jquery - Selectors and event', 'Actions in Jquery - fading, animations and callback function', 'Projects in Jquery and using JS plugins']]","Introduction, getting the dev tools and basics of HTML Div, tables and Forms with Challenge to create FB page HTML 5 semantics and adding audio, video and YouTube to web CSS-Box model, color selection, Google Fonts Web development projects - GYM and Sushi Restro Templates CSS - classes, ID's, parallax and project to edit template CSS - box sizing, gradients and TODO list project Getting started with Bootstrap - Tour and creating landing page Project - Pokemon Corporate site, yahoo selling page and Adm Javascript projects to practice Moving on to learn Jquery - Selectors and event Actions in Jquery - fading, animations and callback function Projects in Jquery and using JS plugins HiteshChoudhary ['Introduction, getting the dev tools and basics of HTML', 'Div, tables and Forms with Challenge to create FB page', 'HTML 5 semantics and adding audio, video and YouTube to web', 'CSS-Box model, color selection, Google Fonts', 'Web development projects - GYM and Sushi Restro Templates', ""CSS - classes, ID's, parallax and project to edit template"", 'CSS - box sizing, gradients and TODO list project', 'Getting started with Bootstrap - Tour and creating landing page', 'Project - Pokemon Corporate site, yahoo selling page and Adm', 'Javascript projects to practice', 'Moving on to learn Jquery - Selectors and event', 'Actions in Jquery - fading, animations and callback function', 'Projects in Jquery and using JS plugins']"
Machine Learning and Data Science Bootcamp,62d1a28b5af3c7774542951c,"['Getting started with Machine Learning', 'Installation for Windows and MAC', 'Python Quick Refresher', 'Mastering NUMPY Library', 'Mastering PANDAS Library', 'Mastering MATPLOTLIB Library', 'Mastering SEABORN Library', 'Multi index Matrix', 'Portfolio Project - Classic 911 analysis', 'Data preprocessing for Machine Learning', 'Supervised, Unsupervised and Reinforcement Learning', 'Linear regression algorithm', 'Portfolio Project - Housing dataset analysis', 'Decision Tree Regression Algorithm', 'K-Nearest Neighbors Algorithm', 'Support Vector Machine Classifier', 'Nave Bayes Algorithm', 'Neural Network and Deep Learning', 'HiteshChoudhary', ['Getting started with Machine Learning', 'Installation for Windows and MAC', 'Python Quick Refresher', 'Mastering NUMPY Library', 'Mastering PANDAS Library', 'Mastering MATPLOTLIB Library', 'Mastering SEABORN Library', 'Multi index Matrix', 'Portfolio Project - Classic 911 analysis', 'Data preprocessing for Machine Learning', 'Supervised, Unsupervised and Reinforcement Learning', 'Linear regression algorithm', 'Portfolio Project - Housing dataset analysis', 'Decision Tree Regression Algorithm', 'K-Nearest Neighbors Algorithm', 'Support Vector Machine Classifier', 'Nave Bayes Algorithm', 'Neural Network and Deep Learning']]","Getting started with Machine Learning Installation for Windows and MAC Python Quick Refresher Mastering NUMPY Library Mastering PANDAS Library Mastering MATPLOTLIB Library Mastering SEABORN Library Multi index Matrix Portfolio Project - Classic 911 analysis Data preprocessing for Machine Learning Supervised, Unsupervised and Reinforcement Learning Linear regression algorithm Portfolio Project - Housing dataset analysis Decision Tree Regression Algorithm K-Nearest Neighbors Algorithm Support Vector Machine Classifier Nave Bayes Algorithm Neural Network and Deep Learning HiteshChoudhary ['Getting started with Machine Learning', 'Installation for Windows and MAC', 'Python Quick Refresher', 'Mastering NUMPY Library', 'Mastering PANDAS Library', 'Mastering MATPLOTLIB Library', 'Mastering SEABORN Library', 'Multi index Matrix', 'Portfolio Project - Classic 911 analysis', 'Data preprocessing for Machine Learning', 'Supervised, Unsupervised and Reinforcement Learning', 'Linear regression algorithm', 'Portfolio Project - Housing dataset analysis', 'Decision Tree Regression Algorithm', 'K-Nearest Neighbors Algorithm', 'Support Vector Machine Classifier', 'Nave Bayes Algorithm', 'Neural Network and Deep Learning']"
Publishing Custom Cocoapads,62d1a08d5af3c74c7a4294a6,"['How to publish your own cocoapods', 'Installing cocoapods', 'Creating and exploring cocoapods to be published', 'Editing podsec and github push', 'Writing custom function for cocoapods', 'Writing a test case for cocoapods', 'Finally 2C lets push our first cocoapod', 'HiteshChoudhary', ['How to publish your own cocoapods', 'Installing cocoapods', 'Creating and exploring cocoapods to be published', 'Editing podsec and github push', 'Writing custom function for cocoapods', 'Writing a test case for cocoapods', 'Finally 2C lets push our first cocoapod']]","How to publish your own cocoapods Installing cocoapods Creating and exploring cocoapods to be published Editing podsec and github push Writing custom function for cocoapods Writing a test case for cocoapods Finally 2C lets push our first cocoapod HiteshChoudhary ['How to publish your own cocoapods', 'Installing cocoapods', 'Creating and exploring cocoapods to be published', 'Editing podsec and github push', 'Writing custom function for cocoapods', 'Writing a test case for cocoapods', 'Finally 2C lets push our first cocoapod']"
Build an Ecommerce with ReactJS,62d19eca5af3c72ff2429437,"['Design a complete E commerce modern website', 'Goal of this project and prerequisite', 'Basic navbar finished', 'Design myToggler button', 'Menu links from state of react', 'Reading contentful docs', 'adding data in contentful', 'Environment variables in react', 'Graphql query on contentful', 'How to push react project to github', 'How to deploy website to netlify', 'How to add web hooks in netlify', 'HiteshChoudhary', ['Design a complete E commerce modern website', 'Goal of this project and prerequisite', 'Basic navbar finished', 'Design myToggler button', 'Menu links from state of react', 'Reading contentful docs', 'adding data in contentful', 'Environment variables in react', 'Graphql query on contentful', 'How to push react project to github', 'How to deploy website to netlify', 'How to add web hooks in netlify']]","Design a complete E commerce modern website Goal of this project and prerequisite Basic navbar finished Design myToggler button Menu links from state of react Reading contentful docs adding data in contentful Environment variables in react Graphql query on contentful How to push react project to github How to deploy website to netlify How to add web hooks in netlify HiteshChoudhary ['Design a complete E commerce modern website', 'Goal of this project and prerequisite', 'Basic navbar finished', 'Design myToggler button', 'Menu links from state of react', 'Reading contentful docs', 'adding data in contentful', 'Environment variables in react', 'Graphql query on contentful', 'How to push react project to github', 'How to deploy website to netlify', 'How to add web hooks in netlify']"
Python3 Scratch To Pro,62d195225af3c759ab429359,"['Introduction and installation of python', 'First interaction with python basics', 'Conditionals and loops', 'Detail analysis of data types', 'Functions Files and Exceptions', 'Python challenges for fun', 'Object Oriented programming in python', 'Database TODO App', 'Advance side of python', 'Handling API in Python', 'HiteshChoudhary', ['Introduction and installation of python', 'First interaction with python basics', 'Conditionals and loops', 'Detail analysis of data types', 'Functions Files and Exceptions', 'Python challenges for fun', 'Object Oriented programming in python', 'Database TODO App', 'Advance side of python', 'Handling API in Python']]","Introduction and installation of python First interaction with python basics Conditionals and loops Detail analysis of data types Functions Files and Exceptions Python challenges for fun Object Oriented programming in python Database TODO App Advance side of python Handling API in Python HiteshChoudhary ['Introduction and installation of python', 'First interaction with python basics', 'Conditionals and loops', 'Detail analysis of data types', 'Functions Files and Exceptions', 'Python challenges for fun', 'Object Oriented programming in python', 'Database TODO App', 'Advance side of python', 'Handling API in Python']"
ReactJS Crash Course,62d18e235af3c732c0429307,"['React templates', 'React states', 'React hooks', 'React context API', 'Firebase integration', 'Redux Apps', 'HiteshChoudhary', ['React templates', 'React states', 'React hooks', 'React context API', 'Firebase integration', 'Redux Apps']]","React templates React states React hooks React context API Firebase integration Redux Apps HiteshChoudhary ['React templates', 'React states', 'React hooks', 'React context API', 'Firebase integration', 'Redux Apps']"
Angular Crash Course,62d18cd45af3c7b9924292ef,"['Angular crash course', 'HiteshChoudhary', ['Angular crash course']]",Angular crash course HiteshChoudhary ['Angular crash course']
Python Crash Course by Hitesh,62d189615af3c71c4c4292d7,"['Python crash course', 'HiteshChoudhary', ['Python crash course']]",Python crash course HiteshChoudhary ['Python crash course']
