index,_id,tags,tags1
Masterclass Why study Web Development & DSA Usecases in Industry,6448cc5b456292fbbf29c40a,"['Why web development?', 'DSA Applications in Industry explained', 'SanketSingh', ['Why web development?', 'DSA Applications in Industry explained']]","Why web development? DSA Applications in Industry explained SanketSingh ['Why web development?', 'DSA Applications in Industry explained']"
Building Scalable Applications in Java & Spring Masterclass,64410265456292ae2029a179,"['Building Scalable Applications', 'Understanding Scalability', 'Designing for Scalability', 'Microservices', 'Case Studies', 'VishwaMohan', ['Building Scalable Applications', 'Understanding Scalability', 'Designing for Scalability', 'Microservices', 'Case Studies']]","Building Scalable Applications Understanding Scalability Designing for Scalability Microservices Case Studies VishwaMohan ['Building Scalable Applications', 'Understanding Scalability', 'Designing for Scalability', 'Microservices', 'Case Studies']"
Machine Learning Community Class,643e93ae4562920804297cae,"['Master Machine Learning on Python', 'Supervised Learning', 'Classification Algorithms', 'Regression Algorithms', 'krishnaik', ['Master Machine Learning on Python', 'Supervised Learning', 'Classification Algorithms', 'Regression Algorithms']]","Master Machine Learning on Python Supervised Learning Classification Algorithms Regression Algorithms krishnaik ['Master Machine Learning on Python', 'Supervised Learning', 'Classification Algorithms', 'Regression Algorithms']"
Mastering Databases,643972c34562920139294607,"['Fundamental concepts of databases', 'Data Integrity', 'Database Design', 'Data integrity', 'SudhanshuKumar', 'VishwaMohan', ['Fundamental concepts of databases', 'Data Integrity', 'Database Design', 'Data integrity']]","Fundamental concepts of databases Data Integrity Database Design Data integrity SudhanshuKumar VishwaMohan ['Fundamental concepts of databases', 'Data Integrity', 'Database Design', 'Data integrity']"
CarDekho End to End Project,6439281045629264f12943d8,"['End to End Project', 'Machine Learning Project', 'krishnaik', ['End to End Project', 'Machine Learning Project']]","End to End Project Machine Learning Project krishnaik ['End to End Project', 'Machine Learning Project']"
Full Stack Data Science Masters,63f46e5647b032343fe2bea1,"['Python', 'Flask', 'Numpy', 'Pandas', 'Visualization', 'Databases', 'EDA', 'Linear Algebra', 'Statistics', 'Machine Learning', 'Deep learning', 'Computer vision', 'Natural language processing', 'SourangshuPal', 'krishnaik', 'SudhanshuKumar', 'SunnySavita', 'BoktiarAhmedBappy', 'Dr.FurqanAlam', 'AjayKumar', 'JAYANTILALBHANUSHALI', 'KausthabDuttaPhukan', ['Python', 'Flask', 'Numpy', 'Pandas', 'Visualization', 'Databases', 'EDA', 'Linear Algebra', 'Statistics', 'Machine Learning', 'Deep learning', 'Computer vision', 'Natural language processing']]","Python Flask Numpy Pandas Visualization Databases EDA Linear Algebra Statistics Machine Learning Deep learning Computer vision Natural language processing SourangshuPal krishnaik SudhanshuKumar SunnySavita BoktiarAhmedBappy Dr.FurqanAlam AjayKumar JAYANTILALBHANUSHALI KausthabDuttaPhukan ['Python', 'Flask', 'Numpy', 'Pandas', 'Visualization', 'Databases', 'EDA', 'Linear Algebra', 'Statistics', 'Machine Learning', 'Deep learning', 'Computer vision', 'Natural language processing']"
Complete DSA in Python,63bbd0863d8c5c05632becbc,"['Introduction to Algorithms', 'Analysis in Algorithms', 'Array Data Structure', 'Heap Data Structure', 'Recursion', 'Divide and Conquer', 'Linked List Data Structure', 'Stack and Queue', 'Hashing Data Structure', 'Tree Data Structure', 'Binary Search Tree', 'Graph Traversal Algorithms', 'Application of greedy algorithm', 'Dynamic Programming', 'Research Area- P, NP, NP-Hard and NP-Complete Problems', 'PriyaBhatia', ['Introduction to Algorithms', 'Analysis in Algorithms', 'Array Data Structure', 'Heap Data Structure', 'Recursion', 'Divide and Conquer', 'Linked List Data Structure', 'Stack and Queue', 'Hashing Data Structure', 'Tree Data Structure', 'Binary Search Tree', 'Graph Traversal Algorithms', 'Application of greedy algorithm', 'Dynamic Programming', 'Research Area- P, NP, NP-Hard and NP-Complete Problems']]","Introduction to Algorithms Analysis in Algorithms Array Data Structure Heap Data Structure Recursion Divide and Conquer Linked List Data Structure Stack and Queue Hashing Data Structure Tree Data Structure Binary Search Tree Graph Traversal Algorithms Application of greedy algorithm Dynamic Programming Research Area- P, NP, NP-Hard and NP-Complete Problems PriyaBhatia ['Introduction to Algorithms', 'Analysis in Algorithms', 'Array Data Structure', 'Heap Data Structure', 'Recursion', 'Divide and Conquer', 'Linked List Data Structure', 'Stack and Queue', 'Hashing Data Structure', 'Tree Data Structure', 'Binary Search Tree', 'Graph Traversal Algorithms', 'Application of greedy algorithm', 'Dynamic Programming', 'Research Area- P, NP, NP-Hard and NP-Complete Problems']"
Tableau Foundation Course,63b97c2d3d8c5c55052bd531,"['Tableau desktop installation', 'Connecting Tableau with a variety of data sources, including excel and CSV files.', 'Creating interactive dashboard', 'Creating data stories', 'Generating business insights', 'Sorting, Filtering', 'Marks Card', 'Formatting in Tableau', 'Lines and Bands', 'Charts in Tableau', 'DrNishthaJain', ['Tableau desktop installation', 'Connecting Tableau with a variety of data sources, including excel and CSV files.', 'Creating interactive dashboard', 'Creating data stories', 'Generating business insights', 'Sorting, Filtering', 'Marks Card', 'Formatting in Tableau', 'Lines and Bands', 'Charts in Tableau']]","Tableau desktop installation Connecting Tableau with a variety of data sources, including excel and CSV files. Creating interactive dashboard Creating data stories Generating business insights Sorting, Filtering Marks Card Formatting in Tableau Lines and Bands Charts in Tableau DrNishthaJain ['Tableau desktop installation', 'Connecting Tableau with a variety of data sources, including excel and CSV files.', 'Creating interactive dashboard', 'Creating data stories', 'Generating business insights', 'Sorting, Filtering', 'Marks Card', 'Formatting in Tableau', 'Lines and Bands', 'Charts in Tableau']"
Complete Excel Course,63b97ada3d8c5c0f6f2bd343,"['String functions on Excel', 'Mathematical functions on Excel', 'Logical & error functions on Excel', 'Excel formatting', 'Custom formatting', 'Conditional formatting', 'Charts in Excel', 'Data analysis using Excel', 'Pivot tables', 'Dashboarding in Excel', 'DrNishthaJain', ['String functions on Excel', 'Mathematical functions on Excel', 'Logical & error functions on Excel', 'Excel formatting', 'Custom formatting', 'Conditional formatting', 'Charts in Excel', 'Data analysis using Excel', 'Pivot tables', 'Dashboarding in Excel']]","String functions on Excel Mathematical functions on Excel Logical & error functions on Excel Excel formatting Custom formatting Conditional formatting Charts in Excel Data analysis using Excel Pivot tables Dashboarding in Excel DrNishthaJain ['String functions on Excel', 'Mathematical functions on Excel', 'Logical & error functions on Excel', 'Excel formatting', 'Custom formatting', 'Conditional formatting', 'Charts in Excel', 'Data analysis using Excel', 'Pivot tables', 'Dashboarding in Excel']"
Automatic Number Plate Recognition,63932ecfe714c0e744532e42,"['Real Time Projects', 'Automatic Number Plate Recognition', 'Object detection using tensorflow', 'Paddle OCR', 'Modular Coding Techniques', 'Learn about AWS basics along with CICD tools like Github actions for production-grade deployment', 'Flask web framework', 'krishnaik', ['Real Time Projects', 'Automatic Number Plate Recognition', 'Object detection using tensorflow', 'Paddle OCR', 'Modular Coding Techniques', 'Learn about AWS basics along with CICD tools like Github actions for production-grade deployment', 'Flask web framework']]","Real Time Projects Automatic Number Plate Recognition Object detection using tensorflow Paddle OCR Modular Coding Techniques Learn about AWS basics along with CICD tools like Github actions for production-grade deployment Flask web framework krishnaik ['Real Time Projects', 'Automatic Number Plate Recognition', 'Object detection using tensorflow', 'Paddle OCR', 'Modular Coding Techniques', 'Learn about AWS basics along with CICD tools like Github actions for production-grade deployment', 'Flask web framework']"
Build Modern ETL Data Pipeline using Informatica cloud,63930a3be714c06fd6532008,"['Real Time Projects', 'Build Modern ETL Data Pipeline using Infomatica cloud', 'Components of a Data Engineering Platform', 'Building ETL Pipeline', 'How to store data in the data warehouse ', 'Build Dashboard using Tableau', 'Informatica Cloud', 'Imran', ['Real Time Projects', 'Build Modern ETL Data Pipeline using Infomatica cloud', 'Components of a Data Engineering Platform', 'Building ETL Pipeline', 'How to store data in the data warehouse ', 'Build Dashboard using Tableau', 'Informatica Cloud']]","Real Time Projects Build Modern ETL Data Pipeline using Infomatica cloud Components of a Data Engineering Platform Building ETL Pipeline How to store data in the data warehouse  Build Dashboard using Tableau Informatica Cloud Imran ['Real Time Projects', 'Build Modern ETL Data Pipeline using Infomatica cloud', 'Components of a Data Engineering Platform', 'Building ETL Pipeline', 'How to store data in the data warehouse ', 'Build Dashboard using Tableau', 'Informatica Cloud']"
Build ETL Data Pipeline on AWS EMR Cluster,6393081fe714c07ed5531fc4,"['Real Time Projects', 'Build ETL Data Pipeline on AWS EMR Cluster', 'Components of a Data Engineering Platform', 'Building ETL Pipeline', 'Store data in the data warehouse ', 'Build Dashboard using Tableau', 'Hive', 'Imran', ['Real Time Projects', 'Build ETL Data Pipeline on AWS EMR Cluster', 'Components of a Data Engineering Platform', 'Building ETL Pipeline', 'Store data in the data warehouse ', 'Build Dashboard using Tableau', 'Hive']]","Real Time Projects Build ETL Data Pipeline on AWS EMR Cluster Components of a Data Engineering Platform Building ETL Pipeline Store data in the data warehouse  Build Dashboard using Tableau Hive Imran ['Real Time Projects', 'Build ETL Data Pipeline on AWS EMR Cluster', 'Components of a Data Engineering Platform', 'Building ETL Pipeline', 'Store data in the data warehouse ', 'Build Dashboard using Tableau', 'Hive']"
Create A Data Pipeline based on Messaging Using PySpark and Airflow,63930221e714c04564531ea8,"['Real Time Projects', 'Create A Data Pipeline based on Messaging Using PySpark and Airflow ', 'Build End to End Datapipeline', 'How to Extract Streaming Data into NFFI', 'Data Encryption', 'Data processing using pyspark', 'Build Dashboards', 'Imran', ['Real Time Projects', 'Create A Data Pipeline based on Messaging Using PySpark and Airflow ', 'Build End to End Datapipeline', 'How to Extract Streaming Data into NFFI', 'Data Encryption', 'Data processing using pyspark', 'Build Dashboards']]","Real Time Projects Create A Data Pipeline based on Messaging Using PySpark and Airflow  Build End to End Datapipeline How to Extract Streaming Data into NFFI Data Encryption Data processing using pyspark Build Dashboards Imran ['Real Time Projects', 'Create A Data Pipeline based on Messaging Using PySpark and Airflow ', 'Build End to End Datapipeline', 'How to Extract Streaming Data into NFFI', 'Data Encryption', 'Data processing using pyspark', 'Build Dashboards']"
Hive Project to build a data warehouse for e-Commerce,639300ede714c01ec2531e53,"['Real Time Projects', 'Hive Project to build a data warehouse for e-Commerce', 'Understanding various services provided by AWS', 'Creating an AWS EC2 instance', 'Moving the data from MySQL to HDFS', 'Data ingestions using Sqoop, Spark and Hive', 'Understanding different analytical functions in Hive', 'PriyaBhatia', ['Real Time Projects', 'Hive Project to build a data warehouse for e-Commerce', 'Understanding various services provided by AWS', 'Creating an AWS EC2 instance', 'Moving the data from MySQL to HDFS', 'Data ingestions using Sqoop, Spark and Hive', 'Understanding different analytical functions in Hive']]","Real Time Projects Hive Project to build a data warehouse for e-Commerce Understanding various services provided by AWS Creating an AWS EC2 instance Moving the data from MySQL to HDFS Data ingestions using Sqoop, Spark and Hive Understanding different analytical functions in Hive PriyaBhatia ['Real Time Projects', 'Hive Project to build a data warehouse for e-Commerce', 'Understanding various services provided by AWS', 'Creating an AWS EC2 instance', 'Moving the data from MySQL to HDFS', 'Data ingestions using Sqoop, Spark and Hive', 'Understanding different analytical functions in Hive']"
House Price Prediction,6392e14fe714c0a0c7531c96,"['Real Time Projects', 'House Price Prediction', 'Preparing Dataset And Basic Analysis', 'Preparing Dataset For Model Training', 'Training the Model', 'Performance Metrics', 'Creating A Flask Web Application', 'Deployment', 'krishnaik', ['Real Time Projects', 'House Price Prediction', 'Preparing Dataset And Basic Analysis', 'Preparing Dataset For Model Training', 'Training the Model', 'Performance Metrics', 'Creating A Flask Web Application', 'Deployment']]","Real Time Projects House Price Prediction Preparing Dataset And Basic Analysis Preparing Dataset For Model Training Training the Model Performance Metrics Creating A Flask Web Application Deployment krishnaik ['Real Time Projects', 'House Price Prediction', 'Preparing Dataset And Basic Analysis', 'Preparing Dataset For Model Training', 'Training the Model', 'Performance Metrics', 'Creating A Flask Web Application', 'Deployment']"
MLFlow Production Server Setup,6391b90fe714c07135531a3d,"['Real Time Projects', 'Mlflow production server setup', 'Understand MLOPS best practices', 'Understand  Aws cloud ec2 and mysql', 'Setup Mlflow server in production ', 'Understand authentication with nginx', 'Get hands on with server setup', 'KetanGangal', ['Real Time Projects', 'Mlflow production server setup', 'Understand MLOPS best practices', 'Understand  Aws cloud ec2 and mysql', 'Setup Mlflow server in production ', 'Understand authentication with nginx', 'Get hands on with server setup']]","Real Time Projects Mlflow production server setup Understand MLOPS best practices Understand  Aws cloud ec2 and mysql Setup Mlflow server in production  Understand authentication with nginx Get hands on with server setup KetanGangal ['Real Time Projects', 'Mlflow production server setup', 'Understand MLOPS best practices', 'Understand  Aws cloud ec2 and mysql', 'Setup Mlflow server in production ', 'Understand authentication with nginx', 'Get hands on with server setup']"
Sensor Fault Prediction,6391b7e3e714c03a415319fb,"['Real Time Projects', 'Sensor Fault Prediction', 'Understand MLOPS best practices', 'EDA and Feature engineering on sensors reading generated by vehicle air pressure system', 'Industry standard Machine Learning development', 'Implementation of Continuous Training', 'Deploying Machine Learning Model as an endpoint API', 'Continous Monitoring', 'Model Management', 'AvnishYadav', ['Real Time Projects', 'Sensor Fault Prediction', 'Understand MLOPS best practices', 'EDA and Feature engineering on sensors reading generated by vehicle air pressure system', 'Industry standard Machine Learning development', 'Implementation of Continuous Training', 'Deploying Machine Learning Model as an endpoint API', 'Continous Monitoring', 'Model Management']]","Real Time Projects Sensor Fault Prediction Understand MLOPS best practices EDA and Feature engineering on sensors reading generated by vehicle air pressure system Industry standard Machine Learning development Implementation of Continuous Training Deploying Machine Learning Model as an endpoint API Continous Monitoring Model Management AvnishYadav ['Real Time Projects', 'Sensor Fault Prediction', 'Understand MLOPS best practices', 'EDA and Feature engineering on sensors reading generated by vehicle air pressure system', 'Industry standard Machine Learning development', 'Implementation of Continuous Training', 'Deploying Machine Learning Model as an endpoint API', 'Continous Monitoring', 'Model Management']"
Text Summarization,6391b49de714c01ed55319b1,"['Real Time Projects', 'Text Summarization', 'Understand best coding practice in modular way', 'How to use Pre-Trained model from hugging face', 'How to Fine tune a pretrained model', 'Create a custom dataset and dataloader for faster loading of the data', 'Use Training pipeline and Prediction pipeline along with CICD to GCP', 'BharathJPV', ['Real Time Projects', 'Text Summarization', 'Understand best coding practice in modular way', 'How to use Pre-Trained model from hugging face', 'How to Fine tune a pretrained model', 'Create a custom dataset and dataloader for faster loading of the data', 'Use Training pipeline and Prediction pipeline along with CICD to GCP']]","Real Time Projects Text Summarization Understand best coding practice in modular way How to use Pre-Trained model from hugging face How to Fine tune a pretrained model Create a custom dataset and dataloader for faster loading of the data Use Training pipeline and Prediction pipeline along with CICD to GCP BharathJPV ['Real Time Projects', 'Text Summarization', 'Understand best coding practice in modular way', 'How to use Pre-Trained model from hugging face', 'How to Fine tune a pretrained model', 'Create a custom dataset and dataloader for faster loading of the data', 'Use Training pipeline and Prediction pipeline along with CICD to GCP']"
The Ultimate Guide To OpenAI GPT-3 & Fine Tune with Custom Data,6391af92e714c021be531979,"['Real Time Projects', 'OpenAI GPT-3 & Fine Tune with Custom data', 'What is GPT-3? ', 'Demo: Build a paraphraser, Chatbot, Summarization', 'OpenAI playground to develop prompts. ', 'Understand various engines and GPT-3 prompt parameters. ', 'Create novel datasets with GPT-3 and Streamlit UI. ', 'Zero-shot and few-shot prompts.', 'Fine tuning GPT3 ', 'BoktiarAhmedBappy', ['Real Time Projects', 'OpenAI GPT-3 & Fine Tune with Custom data', 'What is GPT-3? ', 'Demo: Build a paraphraser, Chatbot, Summarization', 'OpenAI playground to develop prompts. ', 'Understand various engines and GPT-3 prompt parameters. ', 'Create novel datasets with GPT-3 and Streamlit UI. ', 'Zero-shot and few-shot prompts.', 'Fine tuning GPT3 ']]","Real Time Projects OpenAI GPT-3 & Fine Tune with Custom data What is GPT-3?  Demo: Build a paraphraser, Chatbot, Summarization OpenAI playground to develop prompts.  Understand various engines and GPT-3 prompt parameters.  Create novel datasets with GPT-3 and Streamlit UI.  Zero-shot and few-shot prompts. Fine tuning GPT3  BoktiarAhmedBappy ['Real Time Projects', 'OpenAI GPT-3 & Fine Tune with Custom data', 'What is GPT-3? ', 'Demo: Build a paraphraser, Chatbot, Summarization', 'OpenAI playground to develop prompts. ', 'Understand various engines and GPT-3 prompt parameters. ', 'Create novel datasets with GPT-3 and Streamlit UI. ', 'Zero-shot and few-shot prompts.', 'Fine tuning GPT3 ']"
Industry Safety Detection using YOLO v7,6391adcde714c01816531947,"['Real Time Projects', 'Industry Safety Detection using YOLO v7', 'Object detection with YOLO v7', 'Data Annotation', 'How to work with Docker', 'Modular coding approach for training and prediction pipeline ', 'Building Flask app', 'Learn about AWS basics', 'CICD tools like Github actions ', 'Production-grade deployment', 'BoktiarAhmedBappy', ['Real Time Projects', 'Industry Safety Detection using YOLO v7', 'Object detection with YOLO v7', 'Data Annotation', 'How to work with Docker', 'Modular coding approach for training and prediction pipeline ', 'Building Flask app', 'Learn about AWS basics', 'CICD tools like Github actions ', 'Production-grade deployment']]","Real Time Projects Industry Safety Detection using YOLO v7 Object detection with YOLO v7 Data Annotation How to work with Docker Modular coding approach for training and prediction pipeline  Building Flask app Learn about AWS basics CICD tools like Github actions  Production-grade deployment BoktiarAhmedBappy ['Real Time Projects', 'Industry Safety Detection using YOLO v7', 'Object detection with YOLO v7', 'Data Annotation', 'How to work with Docker', 'Modular coding approach for training and prediction pipeline ', 'Building Flask app', 'Learn about AWS basics', 'CICD tools like Github actions ', 'Production-grade deployment']"
Shipment Price Prediction,6391a9f7e714c07d825318e2,"['Real Time Projects', 'Shipment Price Prediction', 'Learn about Regression model implementation', 'Hyperparameter optimization', 'How to work with database', 'Modular coding approach for training and prediction pipeline along with FastAPI ', 'Learn about AWS basics ', 'CICD tools like Github actions ', 'Production-grade deployment', 'BoktiarAhmedBappy', ['Real Time Projects', 'Shipment Price Prediction', 'Learn about Regression model implementation', 'Hyperparameter optimization', 'How to work with database', 'Modular coding approach for training and prediction pipeline along with FastAPI ', 'Learn about AWS basics ', 'CICD tools like Github actions ', 'Production-grade deployment']]","Real Time Projects Shipment Price Prediction Learn about Regression model implementation Hyperparameter optimization How to work with database Modular coding approach for training and prediction pipeline along with FastAPI  Learn about AWS basics  CICD tools like Github actions  Production-grade deployment BoktiarAhmedBappy ['Real Time Projects', 'Shipment Price Prediction', 'Learn about Regression model implementation', 'Hyperparameter optimization', 'How to work with database', 'Modular coding approach for training and prediction pipeline along with FastAPI ', 'Learn about AWS basics ', 'CICD tools like Github actions ', 'Production-grade deployment']"
Finance Complaint,639198fae714c01f2353187a,"['Real Time Projects', 'Finance Complaint', 'Understand MLOPS best practices', 'EDA and Feature engineering on Financial Complaint registered by customers.', 'Industry standard Machine Learning development', 'Implementation of Continuous Training', 'Deploying Machine Learning Model as an endpoint API', 'Continous Monitoring and Model Management', 'ML training using Spark on more than 3 Millions records.', 'AvnishYadav', ['Real Time Projects', 'Finance Complaint', 'Understand MLOPS best practices', 'EDA and Feature engineering on Financial Complaint registered by customers.', 'Industry standard Machine Learning development', 'Implementation of Continuous Training', 'Deploying Machine Learning Model as an endpoint API', 'Continous Monitoring and Model Management', 'ML training using Spark on more than 3 Millions records.']]","Real Time Projects Finance Complaint Understand MLOPS best practices EDA and Feature engineering on Financial Complaint registered by customers. Industry standard Machine Learning development Implementation of Continuous Training Deploying Machine Learning Model as an endpoint API Continous Monitoring and Model Management ML training using Spark on more than 3 Millions records. AvnishYadav ['Real Time Projects', 'Finance Complaint', 'Understand MLOPS best practices', 'EDA and Feature engineering on Financial Complaint registered by customers.', 'Industry standard Machine Learning development', 'Implementation of Continuous Training', 'Deploying Machine Learning Model as an endpoint API', 'Continous Monitoring and Model Management', 'ML training using Spark on more than 3 Millions records.']"
Deep Authenticator,63919492e714c06dc4531816,"['Real Time Projects', 'Deep Authenticator', 'Authentication and Authorization ', 'MTCNN', 'FaceNet', 'FastAPI', 'Azure Container Registry and Azure App Service', 'GitHub Actions CI/CD', 'RishavDash', ['Real Time Projects', 'Deep Authenticator', 'Authentication and Authorization ', 'MTCNN', 'FaceNet', 'FastAPI', 'Azure Container Registry and Azure App Service', 'GitHub Actions CI/CD']]","Real Time Projects Deep Authenticator Authentication and Authorization  MTCNN FaceNet FastAPI Azure Container Registry and Azure App Service GitHub Actions CI/CD RishavDash ['Real Time Projects', 'Deep Authenticator', 'Authentication and Authorization ', 'MTCNN', 'FaceNet', 'FastAPI', 'Azure Container Registry and Azure App Service', 'GitHub Actions CI/CD']"
