index,_id,tags,tags1
Matlab Basic to Advance,62617da6ed35f5cd5c71d00c,"[' MATLAB Graphical User Interface', 'Operations on matrices', 'Interacting with MATLAB and Graphics', 'Structures and Map Containers', [' MATLAB Graphical User Interface', 'Operations on matrices', 'Interacting with MATLAB and Graphics', 'Structures and Map Containers']]"," MATLAB Graphical User Interface Operations on matrices Interacting with MATLAB and Graphics Structures and Map Containers [' MATLAB Graphical User Interface', 'Operations on matrices', 'Interacting with MATLAB and Graphics', 'Structures and Map Containers']"
Salesforce Administrator,625597ad57c66160507d3b9a,"['Cloud Computing And Types', 'Salesforce And Its Products', 'Sales Cloud-Generic Business Process', 'Relationships In Salesforce', ['Cloud Computing And Types', 'Salesforce And Its Products', 'Sales Cloud-Generic Business Process', 'Relationships In Salesforce']]","Cloud Computing And Types Salesforce And Its Products Sales Cloud-Generic Business Process Relationships In Salesforce ['Cloud Computing And Types', 'Salesforce And Its Products', 'Sales Cloud-Generic Business Process', 'Relationships In Salesforce']"
Full Stack Data Science Bootcamp,6248124a006e09832559f938,"['Python', 'Stats', 'Machine learning', 'Deep learning', 'Computer vision', 'Natural language processing', 'Data analytics', 'Big data', 'Ml ops', 'Cloud', 'Architecture', 'Domain wise project', 'Databases', 'Negotiations skills', 'Mock interview', 'Interview preparation', 'Resume building after every module', 'Industry grade projects', 'SunnyBhaveenChandra', 'krishnaik', 'SudhanshuKumar', ['Python', 'Stats', 'Machine learning', 'Deep learning', 'Computer vision', 'Natural language processing', 'Data analytics', 'Big data', 'Ml ops', 'Cloud', 'Architecture', 'Domain wise project', 'Databases', 'Negotiations skills', 'Mock interview', 'Interview preparation', 'Resume building after every module', 'Industry grade projects']]","Python Stats Machine learning Deep learning Computer vision Natural language processing Data analytics Big data Ml ops Cloud Architecture Domain wise project Databases Negotiations skills Mock interview Interview preparation Resume building after every module Industry grade projects SunnyBhaveenChandra krishnaik SudhanshuKumar ['Python', 'Stats', 'Machine learning', 'Deep learning', 'Computer vision', 'Natural language processing', 'Data analytics', 'Big data', 'Ml ops', 'Cloud', 'Architecture', 'Domain wise project', 'Databases', 'Negotiations skills', 'Mock interview', 'Interview preparation', 'Resume building after every module', 'Industry grade projects']"
AWS Data Engineering,62457bcd6edfd558ea9e8437,"['What is EMR', 'EBS Hands On', 'VPC, Subnet, Internet Gateway & NAT Gateways', ['What is EMR', 'EBS Hands On', 'VPC, Subnet, Internet Gateway & NAT Gateways']]","What is EMR EBS Hands On VPC, Subnet, Internet Gateway & NAT Gateways ['What is EMR', 'EBS Hands On', 'VPC, Subnet, Internet Gateway & NAT Gateways']"
Big Data Foundations,623f10d961b4599ca7cada92,"['Big Data Engine Creation', 'Streaming and Batch Processing of Data', 'Various SQL Databases', 'Various NOSQL Databases', 'Real-Time Implementation', 'Spark', 'Hive', 'Talend', 'Informatica', 'Hadoop Distributions', 'Deployment', 'DataBricks Implementation', 'SudhanshuKumar', ['Big Data Engine Creation', 'Streaming and Batch Processing of Data', 'Various SQL Databases', 'Various NOSQL Databases', 'Real-Time Implementation', 'Spark', 'Hive', 'Talend', 'Informatica', 'Hadoop Distributions', 'Deployment', 'DataBricks Implementation']]","Big Data Engine Creation Streaming and Batch Processing of Data Various SQL Databases Various NOSQL Databases Real-Time Implementation Spark Hive Talend Informatica Hadoop Distributions Deployment DataBricks Implementation SudhanshuKumar ['Big Data Engine Creation', 'Streaming and Batch Processing of Data', 'Various SQL Databases', 'Various NOSQL Databases', 'Real-Time Implementation', 'Spark', 'Hive', 'Talend', 'Informatica', 'Hadoop Distributions', 'Deployment', 'DataBricks Implementation']"
Reasoning Live Class,623df2c251d1580e20de56f1,"['Alphabet Test', 'Analogy', 'Arithmetical Reasoning', 'Blood Relations', 'Calendar and Clock Test', 'Classification', 'Coding-Decoding', 'Cubes and Dices Test', 'Data Sufficiency', 'Images', 'Mathematical Operations', 'Non-Verbal Series', 'Number-Ranking-Time Sequence', 'Puzzle Test', 'Series Completion', 'Statements', 'Syllogism', 'Verbal Reasoning', ['Alphabet Test', 'Analogy', 'Arithmetical Reasoning', 'Blood Relations', 'Calendar and Clock Test', 'Classification', 'Coding-Decoding', 'Cubes and Dices Test', 'Data Sufficiency', 'Images', 'Mathematical Operations', 'Non-Verbal Series', 'Number-Ranking-Time Sequence', 'Puzzle Test', 'Series Completion', 'Statements', 'Syllogism', 'Verbal Reasoning']]","Alphabet Test Analogy Arithmetical Reasoning Blood Relations Calendar and Clock Test Classification Coding-Decoding Cubes and Dices Test Data Sufficiency Images Mathematical Operations Non-Verbal Series Number-Ranking-Time Sequence Puzzle Test Series Completion Statements Syllogism Verbal Reasoning ['Alphabet Test', 'Analogy', 'Arithmetical Reasoning', 'Blood Relations', 'Calendar and Clock Test', 'Classification', 'Coding-Decoding', 'Cubes and Dices Test', 'Data Sufficiency', 'Images', 'Mathematical Operations', 'Non-Verbal Series', 'Number-Ranking-Time Sequence', 'Puzzle Test', 'Series Completion', 'Statements', 'Syllogism', 'Verbal Reasoning']"
Spark AR Live Class,623df01851d15892d2de567a,"['Introduction to AR & VR', 'Spark AR', 'Publishing filters', 'Trackers', 'Animation', 'MonalKumar', ['Introduction to AR & VR', 'Spark AR', 'Publishing filters', 'Trackers', 'Animation']]","Introduction to AR & VR Spark AR Publishing filters Trackers Animation MonalKumar ['Introduction to AR & VR', 'Spark AR', 'Publishing filters', 'Trackers', 'Animation']"
Power BI Foundations,623deb9651d158ef56de560a,"['Creating Reports', 'Visualization', 'Real-time insights', 'Dashboarding', 'Business intelligence workflow', 'JayantTopnani', ['Creating Reports', 'Visualization', 'Real-time insights', 'Dashboarding', 'Business intelligence workflow']]","Creating Reports Visualization Real-time insights Dashboarding Business intelligence workflow JayantTopnani ['Creating Reports', 'Visualization', 'Real-time insights', 'Dashboarding', 'Business intelligence workflow']"
Foundations of English Language,623de25e51d1582ddbde54f9,"['Significance of English Language', 'The Sentence', 'Parts of Speech', 'Subject Verb Agreement', 'Tenses', 'Vowels, Consonants and Articles', 'Punctuation marks', 'Suffix and Prefix', 'Sentence Structure', 'Active and Passive Voice', 'Direct and Indirect Speech', 'Reading comprehension', 'Odd one out', 'Figures of Speech', 'DrNishthaJain', ['Significance of English Language', 'The Sentence', 'Parts of Speech', 'Subject Verb Agreement', 'Tenses', 'Vowels, Consonants and Articles', 'Punctuation marks', 'Suffix and Prefix', 'Sentence Structure', 'Active and Passive Voice', 'Direct and Indirect Speech', 'Reading comprehension', 'Odd one out', 'Figures of Speech']]","Significance of English Language The Sentence Parts of Speech Subject Verb Agreement Tenses Vowels, Consonants and Articles Punctuation marks Suffix and Prefix Sentence Structure Active and Passive Voice Direct and Indirect Speech Reading comprehension Odd one out Figures of Speech DrNishthaJain ['Significance of English Language', 'The Sentence', 'Parts of Speech', 'Subject Verb Agreement', 'Tenses', 'Vowels, Consonants and Articles', 'Punctuation marks', 'Suffix and Prefix', 'Sentence Structure', 'Active and Passive Voice', 'Direct and Indirect Speech', 'Reading comprehension', 'Odd one out', 'Figures of Speech']"
Android Programming with Machine Learning Apps,623c5b768af2b9e5f26a43a3,"['Android Studio fundamentals', 'Theme customization', 'Buttons and toasts', 'Fully customized Gradles', 'Android elements and components', 'SQLite database', 'JSON and APIs', 'Firebase', 'Machine Learning in Android', 'Various projects', 'HiteshChoudhary', ['Android Studio fundamentals', 'Theme customization', 'Buttons and toasts', 'Fully customized Gradles', 'Android elements and components', 'SQLite database', 'JSON and APIs', 'Firebase', 'Machine Learning in Android', 'Various projects']]","Android Studio fundamentals Theme customization Buttons and toasts Fully customized Gradles Android elements and components SQLite database JSON and APIs Firebase Machine Learning in Android Various projects HiteshChoudhary ['Android Studio fundamentals', 'Theme customization', 'Buttons and toasts', 'Fully customized Gradles', 'Android elements and components', 'SQLite database', 'JSON and APIs', 'Firebase', 'Machine Learning in Android', 'Various projects']"
Pro Backend Developer,623c55528af2b937316a3de9,"['MongoDB', 'Heroku Cloud', 'Swagger', 'Authentication', 'File,image and form handling', 'MORGAN and razorpay', 'Configs and imports', 'Controllers and routes', 'HiteshChoudhary', ['MongoDB', 'Heroku Cloud', 'Swagger', 'Authentication', 'File,image and form handling', 'MORGAN and razorpay', 'Configs and imports', 'Controllers and routes']]","MongoDB Heroku Cloud Swagger Authentication File,image and form handling MORGAN and razorpay Configs and imports Controllers and routes HiteshChoudhary ['MongoDB', 'Heroku Cloud', 'Swagger', 'Authentication', 'File,image and form handling', 'MORGAN and razorpay', 'Configs and imports', 'Controllers and routes']"
Android Chat app with FireBase,623c477e8af2b967a56a3cb1,"['Screen Designing', 'Firebase data authentication', 'Email and password validation', 'Kill switch', 'Chat activity layout', 'Custom adapters for chat applications', 'Firebase event listeners', 'Debugging', 'Handling Gradles', 'Phone verification integration', 'HiteshChoudhary', ['Screen Designing', 'Firebase data authentication', 'Email and password validation', 'Kill switch', 'Chat activity layout', 'Custom adapters for chat applications', 'Firebase event listeners', 'Debugging', 'Handling Gradles', 'Phone verification integration']]","Screen Designing Firebase data authentication Email and password validation Kill switch Chat activity layout Custom adapters for chat applications Firebase event listeners Debugging Handling Gradles Phone verification integration HiteshChoudhary ['Screen Designing', 'Firebase data authentication', 'Email and password validation', 'Kill switch', 'Chat activity layout', 'Custom adapters for chat applications', 'Firebase event listeners', 'Debugging', 'Handling Gradles', 'Phone verification integration']"
AWS Architect for Real World,623c41a38af2b9f05e6a39c5,"['AWS fundamentals', 'S3 buckets', 'Lambda functions', 'SES', 'API gateways', 'Load balancing', 'Migration', 'Container services', 'AWS serverless', 'HiteshChoudhary', ['AWS fundamentals', 'S3 buckets', 'Lambda functions', 'SES', 'API gateways', 'Load balancing', 'Migration', 'Container services', 'AWS serverless']]","AWS fundamentals S3 buckets Lambda functions SES API gateways Load balancing Migration Container services AWS serverless HiteshChoudhary ['AWS fundamentals', 'S3 buckets', 'Lambda functions', 'SES', 'API gateways', 'Load balancing', 'Migration', 'Container services', 'AWS serverless']"
Complete ReactJS Developer Bootcamp,623c3bb08af2b99f7f6a37c3,"['React templates', 'React states', 'React hooks', 'React context API', 'Firebase integration', 'Redux Apps', 'HiteshChoudhary', ['React templates', 'React states', 'React hooks', 'React context API', 'Firebase integration', 'Redux Apps']]","React templates React states React hooks React context API Firebase integration Redux Apps HiteshChoudhary ['React templates', 'React states', 'React hooks', 'React context API', 'Firebase integration', 'Redux Apps']"
Complete Bootstrap - 5 Projects,623c30e98af2b948ce6a35d3,"['Bootstrap Integration and typography', 'Buttons, breakpoints and utilities', 'Team pages', 'Navbars', 'Flexboxes', 'Forms', 'Modals', 'Custom cards', 'HiteshChoudhary', ['Bootstrap Integration and typography', 'Buttons, breakpoints and utilities', 'Team pages', 'Navbars', 'Flexboxes', 'Forms', 'Modals', 'Custom cards']]","Bootstrap Integration and typography Buttons, breakpoints and utilities Team pages Navbars Flexboxes Forms Modals Custom cards HiteshChoudhary ['Bootstrap Integration and typography', 'Buttons, breakpoints and utilities', 'Team pages', 'Navbars', 'Flexboxes', 'Forms', 'Modals', 'Custom cards']"
Django Course,623c24158af2b966986a34a2,"['Webpages in Django', 'Admin control', 'Sliders', 'Search fields', 'Navbars', 'Components', 'User authentication', 'Facebook and Google authentication', 'Django message frameworks', 'Django contact forms', 'HiteshChoudhary', ['Webpages in Django', 'Admin control', 'Sliders', 'Search fields', 'Navbars', 'Components', 'User authentication', 'Facebook and Google authentication', 'Django message frameworks', 'Django contact forms']]","Webpages in Django Admin control Sliders Search fields Navbars Components User authentication Facebook and Google authentication Django message frameworks Django contact forms HiteshChoudhary ['Webpages in Django', 'Admin control', 'Sliders', 'Search fields', 'Navbars', 'Components', 'User authentication', 'Facebook and Google authentication', 'Django message frameworks', 'Django contact forms']"
Back-end development with Django-8 Projects,623c23018af2b96e4b6a33c0,"['Webpages in Django', 'Admin control', 'Sliders', 'Search feilds', 'Navbars', 'Components', 'User authentication', 'Facebook and Google authentication', 'Django message frameworks', 'Django contact forms', 'HiteshChoudhary', ['Webpages in Django', 'Admin control', 'Sliders', 'Search feilds', 'Navbars', 'Components', 'User authentication', 'Facebook and Google authentication', 'Django message frameworks', 'Django contact forms']]","Webpages in Django Admin control Sliders Search feilds Navbars Components User authentication Facebook and Google authentication Django message frameworks Django contact forms HiteshChoudhary ['Webpages in Django', 'Admin control', 'Sliders', 'Search feilds', 'Navbars', 'Components', 'User authentication', 'Facebook and Google authentication', 'Django message frameworks', 'Django contact forms']"
React Native,623c20d28af2b963d76a325d,"['React elements', 'React styles', 'Touchable and props', 'Handling images in React', 'Handling sound in React', 'Handling multiple users', 'Camera integration', 'Redux', 'HiteshChoudhary', ['React elements', 'React styles', 'Touchable and props', 'Handling images in React', 'Handling sound in React', 'Handling multiple users', 'Camera integration', 'Redux']]","React elements React styles Touchable and props Handling images in React Handling sound in React Handling multiple users Camera integration Redux HiteshChoudhary ['React elements', 'React styles', 'Touchable and props', 'Handling images in React', 'Handling sound in React', 'Handling multiple users', 'Camera integration', 'Redux']"
Java Bootcamp,623b17788af2b94ac36a30ec,"['Java data types and variables', 'Java operations and conditionals', 'Arrays', 'Object-Oriented java', 'Searching and Sorting', 'Linked Lists', 'Various java projects', 'HiteshChoudhary', ['Java data types and variables', 'Java operations and conditionals', 'Arrays', 'Object-Oriented java', 'Searching and Sorting', 'Linked Lists', 'Various java projects']]","Java data types and variables Java operations and conditionals Arrays Object-Oriented java Searching and Sorting Linked Lists Various java projects HiteshChoudhary ['Java data types and variables', 'Java operations and conditionals', 'Arrays', 'Object-Oriented java', 'Searching and Sorting', 'Linked Lists', 'Various java projects']"
Kotlin,623ae4368af2b9844b6a3014,"['Kotlin basics', 'Conditionals in Kotlin', 'Advanced Data types', 'Data structures in Kotlin', 'Object oriented Kotlin', 'Making android apps with Kotlin', 'HiteshChoudhary', ['Kotlin basics', 'Conditionals in Kotlin', 'Advanced Data types', 'Data structures in Kotlin', 'Object oriented Kotlin', 'Making android apps with Kotlin']]","Kotlin basics Conditionals in Kotlin Advanced Data types Data structures in Kotlin Object oriented Kotlin Making android apps with Kotlin HiteshChoudhary ['Kotlin basics', 'Conditionals in Kotlin', 'Advanced Data types', 'Data structures in Kotlin', 'Object oriented Kotlin', 'Making android apps with Kotlin']"
Vuejs,623ae2b78af2b904866a2f0a,"['VueJs project structure', 'VueJs data types and methods', 'Passing data to props', 'Adding editable forms in todo', 'Passing methods in vueJs', 'HiteshChoudhary', ['VueJs project structure', 'VueJs data types and methods', 'Passing data to props', 'Adding editable forms in todo', 'Passing methods in vueJs']]","VueJs project structure VueJs data types and methods Passing data to props Adding editable forms in todo Passing methods in vueJs HiteshChoudhary ['VueJs project structure', 'VueJs data types and methods', 'Passing data to props', 'Adding editable forms in todo', 'Passing methods in vueJs']"
Git and GitHub,623ae1118af2b9820a6a2e56,"['Git foundation', 'Setting, maintaining and tracking git repos', 'Git snapshots', 'Git for team management', 'Git branches', 'Git merging', 'Git and Github ecosystem', 'Tags and tickets', 'HiteshChoudhary', ['Git foundation', 'Setting, maintaining and tracking git repos', 'Git snapshots', 'Git for team management', 'Git branches', 'Git merging', 'Git and Github ecosystem', 'Tags and tickets']]","Git foundation Setting, maintaining and tracking git repos Git snapshots Git for team management Git branches Git merging Git and Github ecosystem Tags and tickets HiteshChoudhary ['Git foundation', 'Setting, maintaining and tracking git repos', 'Git snapshots', 'Git for team management', 'Git branches', 'Git merging', 'Git and Github ecosystem', 'Tags and tickets']"
Docker Course,623ae0078af2b94ce86a2dbc,"['Docker containers', 'Containers vs virtual machines', 'Docker fundamentals', 'Custom Docker images', 'Multi container setup', 'Nginx', 'Docker AWS', 'TravisCI', 'HiteshChoudhary', ['Docker containers', 'Containers vs virtual machines', 'Docker fundamentals', 'Custom Docker images', 'Multi container setup', 'Nginx', 'Docker AWS', 'TravisCI']]","Docker containers Containers vs virtual machines Docker fundamentals Custom Docker images Multi container setup Nginx Docker AWS TravisCI HiteshChoudhary ['Docker containers', 'Containers vs virtual machines', 'Docker fundamentals', 'Custom Docker images', 'Multi container setup', 'Nginx', 'Docker AWS', 'TravisCI']"
MySQL,623ada8e8af2b931666a2c90,"['MySQL tables', 'Primary keys and foreign keys', 'CRUD operations', 'SQL queries', 'Joins', 'ACID in database', 'Database engines', 'HiteshChoudhary', ['MySQL tables', 'Primary keys and foreign keys', 'CRUD operations', 'SQL queries', 'Joins', 'ACID in database', 'Database engines']]","MySQL tables Primary keys and foreign keys CRUD operations SQL queries Joins ACID in database Database engines HiteshChoudhary ['MySQL tables', 'Primary keys and foreign keys', 'CRUD operations', 'SQL queries', 'Joins', 'ACID in database', 'Database engines']"
Dart Programming,623ad4c48af2b947b46a2bcd,"['Dart fundamentals', 'Data types in Dart', 'Arrays', 'Maps', 'Constants', 'Operators', 'Conditionals', 'Functions', 'Object Oriented Programming in Dart', 'Asynchronous subroutines', 'HiteshChoudhary', ['Dart fundamentals', 'Data types in Dart', 'Arrays', 'Maps', 'Constants', 'Operators', 'Conditionals', 'Functions', 'Object Oriented Programming in Dart', 'Asynchronous subroutines']]","Dart fundamentals Data types in Dart Arrays Maps Constants Operators Conditionals Functions Object Oriented Programming in Dart Asynchronous subroutines HiteshChoudhary ['Dart fundamentals', 'Data types in Dart', 'Arrays', 'Maps', 'Constants', 'Operators', 'Conditionals', 'Functions', 'Object Oriented Programming in Dart', 'Asynchronous subroutines']"
Flutter,623ad2cb8af2b958ea6a2a0f,"['Stateless widgets', 'Stateful widgets', 'Background changers', 'Randomization', 'Camera and gestures', 'API handling', 'SQLite', 'Firebase', 'BLOC in flutter', 'HiteshChoudhary', ['Stateless widgets', 'Stateful widgets', 'Background changers', 'Randomization', 'Camera and gestures', 'API handling', 'SQLite', 'Firebase', 'BLOC in flutter']]","Stateless widgets Stateful widgets Background changers Randomization Camera and gestures API handling SQLite Firebase BLOC in flutter HiteshChoudhary ['Stateless widgets', 'Stateful widgets', 'Background changers', 'Randomization', 'Camera and gestures', 'API handling', 'SQLite', 'Firebase', 'BLOC in flutter']"
C++ Bootcamp,623acf258af2b9397e6a2856,"['Introduction to CPP', 'Getting Started with CPP', 'Basics but indepth of CPP', 'Functions in CPP', 'Object Oriented Programming', 'Smart Pointers in CPP', 'HiteshChoudhary', ['Introduction to CPP', 'Getting Started with CPP', 'Basics but indepth of CPP', 'Functions in CPP', 'Object Oriented Programming', 'Smart Pointers in CPP']]","Introduction to CPP Getting Started with CPP Basics but indepth of CPP Functions in CPP Object Oriented Programming Smart Pointers in CPP HiteshChoudhary ['Introduction to CPP', 'Getting Started with CPP', 'Basics but indepth of CPP', 'Functions in CPP', 'Object Oriented Programming', 'Smart Pointers in CPP']"
Tableau Course,6238eb5d8e583c0035038351,"['Tableau Vs Excel', 'Pie Chart', 'Data Types in Tableau', 'Scatter Plot', 'PawanLalwani', ['Tableau Vs Excel', 'Pie Chart', 'Data Types in Tableau', 'Scatter Plot']]","Tableau Vs Excel Pie Chart Data Types in Tableau Scatter Plot PawanLalwani ['Tableau Vs Excel', 'Pie Chart', 'Data Types in Tableau', 'Scatter Plot']"
Power BI Course,6238ea978e583cdd86038142,"['Tables and Matrix in Power BI', 'Working with Maps', 'Cards and Filters', 'Power Query', 'PawanLalwani', ['Tables and Matrix in Power BI', 'Working with Maps', 'Cards and Filters', 'Power Query']]","Tables and Matrix in Power BI Working with Maps Cards and Filters Power Query PawanLalwani ['Tables and Matrix in Power BI', 'Working with Maps', 'Cards and Filters', 'Power Query']"
Alteryx Course,6238e99f8e583ca633037fdc,"['ALTERYX - Directory Tool', 'ALTERYX - Browse Tool', 'ALTERYX - TABLE TOOL', 'ALTERYX - CREATE SAMPLE TOOL', 'PawanLalwani', ['ALTERYX - Directory Tool', 'ALTERYX - Browse Tool', 'ALTERYX - TABLE TOOL', 'ALTERYX - CREATE SAMPLE TOOL']]","ALTERYX - Directory Tool ALTERYX - Browse Tool ALTERYX - TABLE TOOL ALTERYX - CREATE SAMPLE TOOL PawanLalwani ['ALTERYX - Directory Tool', 'ALTERYX - Browse Tool', 'ALTERYX - TABLE TOOL', 'ALTERYX - CREATE SAMPLE TOOL']"
C Programming,6238bfd78e583c5713037edc,"['C programming basics', 'C data types', 'C data structures', 'Input/Output in C', 'Control Flow', 'Loops', 'Functions', 'Structs', 'Memory management', 'Macros', 'HiteshChoudhary', ['C programming basics', 'C data types', 'C data structures', 'Input/Output in C', 'Control Flow', 'Loops', 'Functions', 'Structs', 'Memory management', 'Macros']]","C programming basics C data types C data structures Input/Output in C Control Flow Loops Functions Structs Memory management Macros HiteshChoudhary ['C programming basics', 'C data types', 'C data structures', 'Input/Output in C', 'Control Flow', 'Loops', 'Functions', 'Structs', 'Memory management', 'Macros']"
FastAPI,6231cb678e583cba6e037c5d,"['Introduction to API', 'Getting Started with FastAPI', 'Features of FastAPI', 'Python Type Hints', 'MonalKumar', ['Introduction to API', 'Getting Started with FastAPI', 'Features of FastAPI', 'Python Type Hints']]","Introduction to API Getting Started with FastAPI Features of FastAPI Python Type Hints MonalKumar ['Introduction to API', 'Getting Started with FastAPI', 'Features of FastAPI', 'Python Type Hints']"
Career Counselling,62243698760e3e4e61f83835,"['Develop soft skills', 'Design Your Own portfolio', 'Career Counselling(One to One)', 'Time Management', 'ShivanKumar', ['Develop soft skills', 'Design Your Own portfolio', 'Career Counselling(One to One)', 'Time Management']]","Develop soft skills Design Your Own portfolio Career Counselling(One to One) Time Management ShivanKumar ['Develop soft skills', 'Design Your Own portfolio', 'Career Counselling(One to One)', 'Time Management']"
Power Automate,621e208a7b2181acba71e820,"['Micosoft Power automate in details', 'Account Creation', 'Dashboard Overview', 'Cloud flow', 'KhushaliShah', ['Micosoft Power automate in details', 'Account Creation', 'Dashboard Overview', 'Cloud flow']]","Micosoft Power automate in details Account Creation Dashboard Overview Cloud flow KhushaliShah ['Micosoft Power automate in details', 'Account Creation', 'Dashboard Overview', 'Cloud flow']"
R Shiny,621e11de7b21814ba871e7e7,"['RShiny features', 'Architectire', 'Installation', 'User interface', 'R scripts', 'Tutorial', 'Sharing app', 'KhushaliShah', ['RShiny features', 'Architectire', 'Installation', 'User interface', 'R scripts', 'Tutorial', 'Sharing app']]","RShiny features Architectire Installation User interface R scripts Tutorial Sharing app KhushaliShah ['RShiny features', 'Architectire', 'Installation', 'User interface', 'R scripts', 'Tutorial', 'Sharing app']"
ELK Stack,621e0c457b21811ec071e784,"['ELK Stack', 'Elastic search', 'Kibana', 'Logstash', 'Installation', 'Architecture', 'Handson', 'KhushaliShah', ['ELK Stack', 'Elastic search', 'Kibana', 'Logstash', 'Installation', 'Architecture', 'Handson']]","ELK Stack Elastic search Kibana Logstash Installation Architecture Handson KhushaliShah ['ELK Stack', 'Elastic search', 'Kibana', 'Logstash', 'Installation', 'Architecture', 'Handson']"
